{
  "$schema": "https://json-schema.org/draft/2020-12/schema",
  "$id": "crescode://project.schema.json",
  "title": "Crescode Project",
  "description": "Crescode project document. All times are ticks at 960 PPQ.",
  "type": "object",
  "required": ["schemaVersion", "name", "bpm", "tempoMap", "timeSignature", "key", "mode", "sections", "chords", "referenceAudio", "tracks", "libraryGroups", "masterVolume"],
  "properties": {
    "schemaVersion": { "type": "integer", "minimum": 1 },
    "exportedAt": { "type": "string", "format": "date-time" },
    "name": { "type": "string" },
    "bpm": { "type": "number", "minimum": 20, "maximum": 400 },
    "tempoMap": {
      "type": "array", "minItems": 1, "maxItems": 1,
      "items": { "type": "object", "required": ["tick", "bpm"], "properties": { "tick": { "type": "integer", "const": 0 }, "bpm": { "type": "number" } } }
    },
    "timeSignature": {
      "type": "object", "required": ["numerator", "denominator"],
      "properties": { "numerator": { "type": "integer", "minimum": 1, "maximum": 32 }, "denominator": { "enum": [1, 2, 4, 8, 16, 32] } }
    },
    "key": { "type": "integer", "minimum": 0, "maximum": 11 },
    "mode": { "enum": ["Ionian", "Dorian", "Phrygian", "Lydian", "Mixolydian", "Aeolian", "Locrian", "Harmonic Minor", "Melodic Minor", "Whole Tone", "Diminished (Half-Whole)", "Diminished (Whole-Half)"] },
    "sections": {
      "type": "array",
      "items": { "type": "object", "required": ["id", "name", "startBar", "lengthBars"], "properties": { "id": { "type": "string" }, "name": { "type": "string" }, "startBar": { "type": "integer", "minimum": 1 }, "lengthBars": { "type": "integer", "minimum": 1 }, "energy": { "type": "number", "minimum": 0, "maximum": 1, "description": "Section energy 0..1. Optional; missing = neutral 0.5. Single canonical energy field read by the harmony planner." } } }
    },
    "chords": {
      "type": "array",
      "items": { "type": "object", "required": ["id", "symbol", "startTick", "durationTicks"], "properties": { "id": { "type": "string" }, "symbol": { "type": "string" }, "startTick": { "type": "integer", "minimum": 0 }, "durationTicks": { "type": "integer", "minimum": 1 }, "locked": { "type": "boolean", "description": "true = protected from chord generation. Missing/false = unlocked." } } }
    },
    "chordGenSettings": {
      "type": "object", "additionalProperties": false,
      "description": "Chord-generator settings. Optional; older projects use engine defaults.",
      "properties": {
        "complexity": { "type": "integer", "enum": [1, 2, 3] },
        "density": { "type": "integer", "enum": [0, 1, 2] },
        "variation": { "type": "number", "minimum": 0, "maximum": 1 },
        "borrowing": { "enum": ["none", "some", "more"] },
        "cadence": { "enum": ["soft", "balanced", "strong"] },
        "modalEmphasis": { "type": "number", "minimum": 0, "maximum": 1 },
        "preserveIdentity": { "type": "boolean" },
        "sectionAware": { "type": "boolean" },
        "seed": { "type": "integer", "minimum": 0, "maximum": 4294967295 }
      }
    },
    "referenceAudio": {
      "type": "object", "required": ["path", "offsetMs"],
      "properties": { "path": { "type": ["string", "null"] }, "offsetMs": { "type": "number" } }
    },
    "tracks": { "type": "array", "items": { "$ref": "#/$defs/track" } },
    "libraryGroups": {
      "type": "array",
      "items": { "type": "object", "required": ["id", "name", "pluginId", "pluginState"], "properties": { "id": { "type": "string" }, "name": { "type": "string" }, "pluginId": { "type": ["string", "null"] }, "pluginState": { "type": ["string", "null"], "contentEncoding": "base64" } } }
    },
    "masterVolume": { "type": "number", "minimum": 0, "maximum": 1.5 }
  },
  "$defs": {
    "note": {
      "type": "object", "required": ["pitch", "startTick", "durationTicks", "velocity"],
      "properties": { "pitch": { "type": "integer", "minimum": 0, "maximum": 127 }, "startTick": { "type": "integer", "minimum": 0 }, "durationTicks": { "type": "integer", "minimum": 1 }, "velocity": { "type": "integer", "minimum": 1, "maximum": 127 } }
    },
    "track": {
      "type": "object",
      "required": ["id", "name", "family", "color", "role", "lowestNote", "highestNote", "locked", "muted", "soloed", "libraryGroupId", "midiChannel", "frozen", "volume", "pan", "notes"],
      "properties": {
        "id": { "type": "string" }, "name": { "type": "string" },
        "family": { "enum": ["Structure", "Audio", "Strings", "Brass", "Woodwinds", "Percussion", "Keys"] },
        "color": { "type": "string" }, "role": { "type": "string" },
        "lowestNote": { "type": "integer", "minimum": 0, "maximum": 127 },
        "highestNote": { "type": "integer", "minimum": 0, "maximum": 127 },
        "locked": { "type": "boolean" }, "muted": { "type": "boolean" }, "soloed": { "type": "boolean" },
        "libraryGroupId": { "type": ["string", "null"] },
        "midiChannel": { "type": "integer", "minimum": 1, "maximum": 16 },
        "frozen": { "type": "boolean" },
        "volume": { "type": "number", "minimum": 0, "maximum": 1.5 },
        "pan": { "type": "number", "minimum": -1, "maximum": 1 },
        "notes": { "type": "array", "items": { "$ref": "#/$defs/note" } }
      }
    }
  }
}
